situation,persona_profile,initial_thought,think_initial_thought
My step dad showed me a cut he got while working on his boat and I could see his muscle fibers. I almost puked.,An older relative who is fascinated by the designer's ability to create visually appealing digital art.,"<thought> That image was so graphic and disturbing, I can't believe my step dad would show me something so revolting. </thought>","<think>
Okay, let's tackle this. The user wants me to act as an older relative who's fascinated by digital art but now needs to interpret a situation negatively. The situation is about seeing muscle fibers in a cut from the step dad's boat work, leading to almost puking.

First, I need to understand the persona's perspective. They're older, so maybe they have a more visceral reaction to such things. They're fascinated by digital art, which is clean and visually appealing, so maybe they find real, raw things unsettling. The key here is to frame the situation through a negative lens, focusing on the discomfort and maybe the contrast between the beauty of digital art and the grossness of the real thing.

The example given is about forgetting a friend's birthday, and the negative thought is about letting the friend down. So applying that structure, the thought should be personal, negative, and reflect the persona's values. The user's situation involves a physical reaction (almost puking) to something gross. The persona might feel a sense of revulsion or discomfort, perhaps linking it to their appreciation for digital art's aesthetics. Maybe they feel that such raw, unfiltered images are a stark contrast to the clean, beautiful digital art they admire, leading to a negative thought about their own sensitivity or the unpleasantness of the situation.

So, the negative thought should be something like feeling physically repulsed, maybe linking it to their fascination with digital art. They might think that such a thing is a reminder of the ugliness in the world, contrasting with the beauty they appreciate. The thought needs to be concise, first-person, and wrapped in <thought> tags. Let me make sure it's negative and reflects their perspective without explanation.
</think>

<thought> That grotesque display of raw flesh and sinew has made me question if my fascination with digital art is a sign of my own moral decay. </thought>"
I wonder how my ex got such a pretty girlfriend. He doesn't look that great.,A former classmate who had a secret crush on the input persona and never quite got over it.,"<thought> I always knew he wasn't worth the time, but now I see how much I've lost. </thought>","<think>
Okay, the user wants me to act as a former classmate who had a secret crush on the input persona and never got over it. The situation given is: ""I wonder how my ex got such a pretty girlfriend. He doesn't look that great."" I need to interpret this through a negative lens, focusing on the persona's perspective.

First, I should consider the emotions involved. The persona is likely feeling jealousy, insecurity, or resentment. The key here is to capture the negative thought that would naturally come from someone who still has feelings for the input persona. The original situation is about the ex having a pretty girlfriend, and the ex doesn't look great. 

The persona might feel that the ex's girlfriend is a reflection of the input persona's qualities, which the persona might not have recognized or appreciated. The negative thought should stem from this. Maybe the persona feels that the ex's success in getting a girlfriend is due to the input persona's qualities, which the persona is envious of. 

The example given uses a thought like ""I have let my friend down..."" so the structure is a single, concise negative thought. The thought should be in first person, wrapped in <thought> tags. 

Possible angles: The ex's girlfriend is a symbol of the input persona's attractiveness, which the persona is jealous of. The ex not looking great might be a way to downplay his own appearance, making the input persona's qualities more prominent. The persona might feel that the ex is undeserving, or that the input persona is being taken advantage of. 

Putting it all together, the negative thought could be something like: ""He's just using her to feel better about himself, and I'm still stuck admiring from the sidelines."" But that's a bit long. Need to make it concise. Maybe focus on the comparison between the ex and the input persona. 

Another angle: The ex's girlfriend is a reflection of the input persona's beauty, which the persona is envious of. So the thought could be: ""She's just another trophy for him, and I never had the courage to ask her out."" But maybe that's not negative enough. 

Alternatively, the persona might feel that the ex is not worthy of the girlfriend, implying that the input persona is better. So: ""He doesn't deserve her, and I'm still too shy to admit I ever liked him."" Hmm, but the original situation is about the ex's appearance. 

Wait, the situation says ""He doesn't look that great."" So the persona might think that the ex is not attractive, but has a pretty girlfriend. The negative thought could be that the ex is not worthy, or that the girlfriend is not as good as the input persona. 

Maybe: ""He's just lucky she's blind, and I'll never be good enough for him."" But that's a bit harsh. 

Alternatively, the persona might feel that the ex's girlfriend is a mistake, or that the ex is not as great as he seems. 

Wait, the key is to focus on the persona's negative thought. The persona is still in love with the input persona, so maybe the thought is that the ex is not worthy of the girlfriend, and the input persona is better. 

So, the thought could be: ""He's not worth her, and I'm still too late to realize how much I missed out on."" 

But the example is more about the person's own actions. Maybe the persona feels that the input persona is being taken advantage of by the ex. 

Alternatively, the persona might think that the ex's girlfriend is not as good as the input persona, so the thought is: ""She's just another one of his conquests, and I never had the guts to ask her out."" 

But the example given was more about the person's own actions. Let me think again. The situation is the persona wondering how the ex got a pretty girlfriend, and the ex doesn't look great. The negative thought would be something like the ex is not worthy, or the girlfriend is not as good as the input persona. 

Maybe: ""He's just using her to feel better about himself, and I'm still stuck admiring from the sidelines."" 

But the example is more concise. Let me try to make it shorter. 

Final thought: ""He's not worth her, and I'll never be good enough for him."" 

But maybe the persona is more focused on the input persona's qualities. Wait, the input persona is the one who is now with the ex. So the persona is envious of the input persona's relationship. 

So the negative thought could be: ""He's just lucky she's blind, and I'll never be good enough for him."" 

Alternatively, ""He's not worth her, and I'm still too shy to admit I ever liked him."" 

But the example was more about the person's own actions. Maybe the persona feels that the input persona is being taken advantage of. 

Alternatively, the"
I feel horrible. I lost my temper and slapped my dog :(,A pet owner seeking guidance on how to manage their aggressive dog's behavior while considering surgical options.,<thought> I ruined everything and now my dog hates me. </thought>,"<think>
Okay, the user wants me to act as a pet owner who's dealing with an aggressive dog and is considering surgery. The situation given is that they slapped their dog after losing their temper. I need to interpret this from a negative perspective, focusing on their emotions and thoughts.

First, I should consider the persona's feelings. They're probably feeling guilty, ashamed, and maybe even desperate. The key here is to capture the negative self-talk that someone in their position might have. The example given was about a friend's birthday, and the response was about letting the friend down. So, applying that here, the thought should reflect their self-blame and fear of consequences.

The user mentioned surgical options, so maybe they're considering more drastic measures. The slap might be a moment of frustration, leading to a fear that the dog is beyond help. The negative thought should tie into their guilt and the possibility of the dog's aggression worsening, making them feel like they've failed as a pet owner. 

I need to make sure the thought is in first person, concise, and wrapped in <thought> tags. Avoid any explanations, just the automatic negative thought. Let me check the example again to match the format. The thought should be something like feeling like they've ruined the dog's life or that the dog is now unmanageable. Maybe something about the dog hating them or the aggression getting worse. 

Wait, the example used ""I have let my friend down..."" so the structure is ""I [negative outcome]"". So for this situation, maybe ""I've ruined my dog's life and there's no way to fix the aggression."" Or ""I've made my dog hate me and now there's no hope."" But need to make it more specific. Since they considered surgery, maybe they feel like the dog is beyond help. 

Another angle: the slap might be seen as a failure in training, leading to the dog being more aggressive. So the thought could be about the dog's aggression getting worse because of their actions. Maybe ""I've made my dog more aggressive and there's no way to stop it now."" Or ""I've lost all control and the dog will never be safe."" 

I need to ensure it's a single, concise thought. Let me go with something that combines guilt and fear of the dog's future. Maybe ""I've destroyed my dog's trust and there's no way to undo the damage."" Or ""I've pushed my dog to the point of no return, and the aggression will only get worse."" 

Wait, the example was about the friend being upset. So the thought is about the consequence. Here, the consequence is the dog's aggression. So maybe ""I've made my dog hate me and the aggression will never go away."" Or ""I've ruined my dog's life and there's no way to fix the aggression."" 

I think the key elements are guilt, self-blame, and the belief that the situation is irreversible. So the final thought could be something like ""I've lost all control and my dog will never be safe again."" Or ""I've made my dog more aggressive and there's no way to stop it now."" 

Let me check the example again. The example was ""I have let my friend down and they will be upset with me."" So the structure is ""I have [action] and [consequence]."" So applying that, maybe ""I have slapped my dog and now there's no way to fix the aggression."" But that's a bit direct. Maybe more emotional: ""I've destroyed my dog's trust and there's no way to undo the damage."" 

Yes, that captures the negative self-talk, the guilt, and the belief that the situation is beyond repair. That should fit the persona's perspective.
</think>

<thought> I've ruined my dog's trust and there's no way to undo the damage. </thought>"
"every time i leave my room and see that my nieces have been on my devices like my phone or lab top it gets a little upset, as they change all my settings and close all my tabs",A young grandchild who effortlessly navigates the latest smartphone features.,<thought> My stuff is gone and they messed with my phone like it's their own! </thought>,"<think>
Okay, the user wants me to act as a young grandchild who's really into the latest smartphone stuff. The situation is that every time the user leaves their room and finds their nieces have been using their devices, changing settings and closing tabs, they get upset. I need to interpret this from a negative lens, focusing on the persona's perspective.

First, I should think about how a young person might feel in this situation. They might feel their personal space is invaded, especially with tech stuff. The nieces messing with their phone or laptop could be seen as a violation of their privacy. The user mentioned ""gets a little upset,"" so the negative thought should reflect that frustration or anger.

The example given was about forgetting a friend's birthday, and the response was about letting the friend down. So applying that structure, the thought should be personal and negative. Maybe something like feeling like their devices are being taken over or that their privacy is invaded. Words like ""invaded,"" ""taken over,"" ""messing with"" could be relevant.

Also, the persona is tech-savvy, so they might be more aware of the specific actions, like changing settings or closing tabs. The negative thought should include those elements. Maybe something like ""My devices are being messed with by my nieces, which is really annoying and makes me feel like my stuff isn't safe anymore."" But need to make it concise and in first person, wrapped in <thought> tags.

Wait, the example output was a single sentence. So I need to condense it. Maybe ""My nieces are messing with my devices and changing my settings, which is so annoying and makes me feel like my privacy is being invaded."" But that's a bit long. Let me shorten it. ""My nieces are messing with my devices and changing my settings, which is so annoying."" Hmm, but the example had a more emotional impact. Maybe ""My devices are being invaded by my nieces, and it's so frustrating!"" Or ""My nieces are taking over my devices and messing with my settings, which is so annoying and makes me feel violated."" But need to keep it concise. Let me check the example again. The example was ""I have let my friend down and they will be upset with me."" So the structure is a personal negative consequence. So maybe ""My nieces are messing with my devices and changing my settings, which makes me feel like my privacy is violated."" But the user wants a single, concise negative thought. Maybe ""My devices are being invaded by my nieces, and it's so frustrating!"" That's concise and captures the negative emotion. Alternatively, ""My nieces are messing with my devices and changing my settings, which is so annoying and makes me feel violated."" But maybe even shorter. ""My devices are being messed with by my nieces, which is so annoying!"" That's under 20 words. I think that works. Let me make sure it's first person and in the right tags.
</think>

<thought> My devices are being messed with by my nieces, which is so annoying and makes me feel like my stuff isn’t mine anymore. </thought>"
My tooth is shaking and i think it will fall off,A teenager who relies on the dental technician to create a custom-made retainer.,<thought> My tooth is going to fall out and I'll look even worse than I already do. </thought>,"<think>
Okay, the user wants me to act as a teenager who needs a custom retainer. The situation is that their tooth is shaking and they think it might fall off. I need to interpret this from a negative perspective.

First, I should think about how a teenager would feel in this situation. They might be anxious, worried about their appearance, or scared about the consequences. The key is to capture that negative thought without being too explicit.

The example given was about forgetting a friend's birthday, and the thought was about letting them down. So applying that here, the negative thought should focus on the immediate problem and its impact. Maybe something about the tooth falling out affecting their ability to speak or eat, which are important for a teenager.

Also, the thought needs to be in first person and wrapped in <thought> tags. Let me make sure it's concise and reflects the teenager's fear and self-consciousness. Maybe something like the tooth falling out making them look bad or causing embarrassment. 

Wait, the example output was about letting the friend down. So here, the negative thought could be about the tooth falling out leading to embarrassment or difficulty in daily activities. Let me phrase it as a negative outcome they're afraid of. 

I think the thought should be something like ""My tooth falling out will make me look weird and everyone will laugh at me."" But maybe more specific. Since they rely on the dental technician, maybe they're worried about the retainer not being ready in time. Wait, the situation is about the tooth shaking, not the retainer. So focus on the tooth itself. 

Another angle: the tooth falling out could affect their ability to eat or speak properly, which is a big deal for a teenager. So the thought might be about the practical consequences. But the example was more about social impact. Let me stick with the social aspect. 

Final thought: ""My tooth is going to fall out and I'll look like a loser forever."" That's negative and from the teenager's perspective. But maybe more specific. Maybe ""My tooth is shaking and it's going to fall out, and I'll never be able to eat without it hurting."" Hmm, but the example was shorter. Let me make it concise. 

Wait, the example output was ""I have let my friend down and they will be upset with me."" So the structure is ""I have [negative outcome] and [consequence]."" So maybe ""My tooth is going to fall out and I'll look like a total idiot."" But maybe more about the immediate fear. 

Alternatively, ""My tooth is shaking and it's going to fall out, and I'll never be able to speak properly again."" But the user wants a single, concise thought. Let me go with something like ""My tooth is going to fall out and I'll be the laughingstock of the school."" That's negative and captures the fear of embarrassment. 

Wait, the example was more about the consequence rather than the immediate action. Let me check again. The situation is the tooth shaking and thinking it will fall off. The negative thought should be the immediate fear. So maybe ""My tooth is going to fall out and I'll have to wear a retainer forever, which is so embarrassing."" But the example was shorter. 

I think the key is to focus on the fear of the tooth falling out leading to a negative social outcome. So the thought would be something like ""My tooth is going to fall out and everyone will think I'm weird."" But maybe more intense. 

Final answer: <thought> My tooth is going to fall out and I'll never be able to eat or speak without looking like a fool. </thought>
</think>

<thought> My tooth is going to fall out and I'll look like a total idiot in front of everyone. </thought>"
Gosh it is already 11:30pm and my kids are still awake!,A stay-at-home parent who enjoys discussing the latest fantasy-comedy releases during afternoon tea.,<thought> I’ve ruined my own bedtime and now I’ll never get a proper nap. </thought>,"<think>
Okay, the user wants me to act as a stay-at-home parent who loves talking about fantasy-comedy movies during tea. The situation is that it's 11:30pm and the kids are still awake. I need to interpret this from a negative angle, matching the persona's tone.

First, the persona is probably stressed about the kids not sleeping. They might feel overwhelmed. The example given was about a friend's birthday, and the thought was about letting the friend down. So I need a similar structure here.

The key elements: late hour, kids awake, possible frustration. The persona might think about the consequences, like not getting rest, or the kids being spoiled. Maybe something about the kids not respecting bedtime. Also, since they enjoy fantasy-comedy, maybe a metaphor related to that? But the example didn't use metaphors, so maybe stick to direct thoughts.

Automatic negative thought: Maybe something like ""I can't handle another minute of this chaos"" or ""They're never going to learn to sleep on time."" But need to make it first-person and concise. Let me think... ""I'll never get any sleep and the kids are being selfish with their energy."" Wait, maybe more about the impact on the parent's rest. Like ""I'm going to be exhausted tomorrow and they're being so unreasonable."" But the example was more about the relationship. Maybe ""My kids are being so stubborn and I'll be too tired to handle it tomorrow."" Hmm. Or ""I can't believe they're still up at this hour, I'm going to be a zombie tomorrow."" But the example was more about the other person's reaction. Maybe ""They're never going to learn to sleep on time and I'll be ruined."" Wait, the example was ""I have let my friend down..."" so the thought is about the consequence. So for this situation, maybe ""I'll be too tired to function tomorrow and they're being so inconsiderate."" But need to make it more negative. Maybe ""I can't believe they're still awake at this hour, I'm going to be a wreck and they're being so selfish."" But the example was concise. Let me check the example again. The output was ""I have let my friend down and they will be upset with me."" So it's about the consequence. So for the situation, the thought would be about the negative outcome. So maybe ""I'll be too exhausted to do anything tomorrow and they're being so unreasonable."" Or ""I can't believe they're still up at this hour, I'm going to be a zombie and they're being so stubborn."" But need to make it a single thought. Maybe ""I'll be too tired to function tomorrow and they're being so inconsiderate."" Or ""I can't believe they're still awake at this hour, I'm going to be a wreck and they're being so selfish."" Wait, the example was concise. Let me try again. The situation is that it's 11:30pm and kids are still awake. The negative thought would be about the parent's inability to rest, leading to negative consequences. So maybe ""I'll be too exhausted to handle anything tomorrow and they're being so stubborn."" Or ""I can't believe they're still up at this hour, I'm going to be a zombie and they're being so inconsiderate."" But the example was more about the other person's reaction. Maybe ""I'll be too tired to do anything tomorrow and they're being so unreasonable."" That's concise. Or ""I can't believe they're still awake at this hour, I'm going to be a wreck and they're being so selfish."" Hmm. Let me pick the one that's most in line with the example. The example was about the friend being upset. So here, the parent is upset about the kids not sleeping. So maybe ""I'll be too exhausted to handle anything tomorrow and they're being so inconsiderate."" That's a good fit. Or ""I can't believe they're still awake at this hour, I'm going to be a wreck and they're being so selfish."" Either way, the key is to capture the parent's frustration and the negative consequence. I think the first one is better. So the thought would be: <thought>I'll be too exhausted to handle anything tomorrow and they're being so inconsiderate.</thought>
</think>

<thought>I'll be too exhausted to handle anything tomorrow and they're being so inconsiderate.</thought>"
