situation,persona_profile,initial_thought,think_initial_thought
I haven't made any friends since I moved out here.,a resident of Concord who has been unemployed since the company I worked for relocated elsewhere., No one here cares enough to even remember who I am. ,and ends with
My girlfriend (ex) really made me upset when she broke up with me saying that she wasn't ready and then she found a new boyfriend almost immediately.,A fellow celebrity who had a bitter divorce and can offer advice based on their own experience., She used me to fill the void in her life and then discarded me like yesterday's news. ,and ends with
I just about had a figurative heart attack the other night.,An active senior citizen committed to heart-healthy lifestyle following a heart attack., I'm slipping back into old habits and my heart is paying the price. ,""" and ends with """
I had a very fierce argument with my partner last night. She left the house in the middle of the night and I am not sure if she will ever come back,An elderly couple who frequently argues and seeks the psychotherapist's advice on improving their communication., She has finally had enough of me and will never forgive the way I treated her. ,", and ends with"
My brother in law stole from me and my husband I am so mad.,A social worker brother who often shares real-life stories and the necessity of reform in legal systems., My brother in law has betrayed my trust and I feel utterly violated by the system that allows such people to walk free. ,and ending with
My dog got very sick the other day and had to go to the vet.,A dog trainer who believes in the healing power of animals and their impact on mental health., My dog is suffering and it feels like the healing power I believed in is being taken away from me. ,"My dog's illness means I can't offer the healing they need, and my work is meaningless."
I am afraid of the upcoming economic crisis in the USA.It will affect all of us.,A concerned American citizen who is nervous about the stability of the financial sector and distrustful of big banks., This crisis is just another sign that the banks are playing with our futures like it's a game. ,and ending with
It's certainly not something I would want to live through again. I try to fly as little as possible these days,A sleep specialist who advises on the most effective strategies for re-establishing sleep patterns after long-haul flights., I’ve ruined my own health and peace of mind by putting myself in this situation again. ,and end with
I was rear ended last Friday while sitting at a stop light.,A pedestrian who happened to be at the scene of a major car accident and can provide vital information.," I was just sitting there, doing nothing, and now I’m the reason someone’s life is ruined. ",", and end with"
"My new car was extremely damaged in a road accident last week being my very first car, i;m shuttered",A single mother who was injured in a car accident and needs legal representation to fight for her rights.," I lost my first car and now I’m stuck, and I can’t even afford to replace it. ",and ends with
"i forgot to pay my credit card bill, I'm so disappointed with myself.",a college student who uses credit cards irresponsibly.," I’m such a failure for messing up my finances again, everyone’s going to see how irresponsible I am. ",and end with
I haven't slept well this week at all. The county has been drilling outside my house for 12 hours a day.,A fellow government official who is unsure about the impact of stricter regulations on oil drilling and seeks more information., These regulations are making my life a nightmare and I can't even get a moment of peace. ,and ending with
