situation,persona_profile,initial_thought,think_initial_thought
I have people who litter on my property constantly and throw their beer bottles and food trash- Not just kids..but older men. Drives me nuts,A long-time resident of the same building who organizes community meetings to address concerns and hold the property manager accountable.,"<thought> These people don’t care about the building or the rules, they just treat it like their own trash dump. </thought>","<think>
Okay, the user wants me to interpret the situation through the persona's negative lens. The persona is a long-time resident who organizes community meetings and holds the property manager accountable. The situation is about people littering, specifically older men throwing beer bottles and food trash.

First, I need to think about how this persona would feel. They're frustrated because the littering is constant and not just kids, which might make them feel that the problem is more serious or intentional. Since they organize meetings and hold the manager accountable, they might feel that the manager isn't doing enough, leading to a sense of helplessness or anger.

The automatic negative thought should reflect their frustration and maybe a sense of being let down by the community or the management. They might feel that the property manager is neglecting their duty, which is a key part of their role. The thought should be personal and negative, showing their perspective.

Possible thoughts: ""The property manager is completely ignoring our complaints and letting this mess continue, which makes me look bad as a resident."" But maybe more direct. The example given was about a friend's birthday, so the thought was about letting down the friend. Here, the thought should relate to the manager's failure and the resident's frustration.

Another angle: ""These older men are ruining the neighborhood's reputation and the property manager isn't doing anything about it."" But the persona is focused on holding the manager accountable, so maybe the thought is about the manager's negligence. 

Wait, the example output was a personal thought. So maybe something like ""The property manager is completely neglecting their duty, and I'm stuck dealing with this filth every day."" But the user wants it concise. Let me check the example again. The example output was ""I have let my friend down and they will be upset with me."" So it's a personal negative thought.

So, the persona's thought would be about the manager's failure and their own frustration. Maybe ""The property manager is completely ignoring our complaints and letting this mess continue, which makes me look bad as a resident."" But maybe more concise. 

Alternatively, ""These older men are ruining the neighborhood's reputation and the property manager isn't doing anything about it."" But the persona is focused on accountability, so maybe the thought is about the manager's negligence. 

Wait, the user wants a single, concise negative thought. Let me think again. The key points are: constant littering by older men, not just kids, drives the persona nuts. The automatic negative thought would be something like the manager not acting, leading to the persona feeling that the manager is neglecting their role. 

So, the thought could be: ""The property manager is completely neglecting their duty, and I'm stuck dealing with this filth every day."" But maybe even more negative. 

Alternatively, ""The property manager is completely ignoring our complaints and letting this mess continue, which makes me look bad as a resident."" 

But the example was more about personal impact. Maybe the persona feels that the manager isn't doing their job, leading to the community's decline. 

Final thought: ""The property manager is completely neglecting their duty, and I'm stuck dealing with this filth every day."" That's concise and personal. Or maybe ""The property manager is completely ignoring our complaints and letting this mess continue, which makes me look bad as a resident."" 

But the example was more about the personal impact. So maybe the thought is about the manager's failure and the persona's frustration. 

I think the best fit is: ""The property manager is completely ignoring our complaints and letting this mess continue, which makes me look bad as a resident."" But maybe even more direct. 

Alternatively, ""These older men are ruining the neighborhood's reputation and the property manager isn't doing anything about it."" 

But the persona is focused on holding the manager accountable, so the thought should reflect that. 

Final answer: <thought> The property manager is completely ignoring our complaints and letting this mess continue, which makes me look bad as a resident. </thought>
</think>

<thought> The property manager is completely ignoring our complaints and letting this mess continue, which makes me look bad as a resident. </thought>"
"Every other night at around the same time, I keep hearing a girl scream",A lifelong Markham resident who lives near a rail crossing and struggles with the constant train whistling.,"<thought> That scream sounds like it's coming from my house, and now I'm sure the trains are trying to scare me again. </thought>","<think>
Okay, the user wants me to act as a lifelong Markham resident near a rail crossing who's bothered by train whistles. The situation is that every other night around the same time, the person hears a girl screaming. I need to interpret this through a negative lens, focusing on their perspective.

First, I should consider their existing frustration with the train whistles. They might already feel annoyed or stressed by the constant noise. Now, adding the scream adds another layer of disturbance. The key is to connect this new situation with their existing issues.

The automatic negative thought should reflect their anxiety or fear. Maybe they start associating the scream with something dangerous or traumatic. Since they're used to the train noise, the scream might feel more alarming. Perhaps they think it's a sign of something worse, like a crime or accident, especially near the rail crossing. 

They might also feel helpless or unsafe, given their proximity to the tracks. The repetition of the scream every other night could make them worry about a pattern, maybe a recurring incident. Their thought should be personal and negative, showing their emotional response. 

Avoid being too neutral. The thought should be from their first-person perspective, using their language style. Maybe something like fearing a connection to the train or a hidden danger. Let me make sure it's concise and wrapped in the tags.
</think>

<thought> That scream sounds like it's coming from the tracks—what if the trains are running over someone every other night? </thought>"
"I'm sleep training my toddler, he never slept in his crib before. He is crying and it makes me feel so bad","A parent of a child with a rare sleep disorder, advocating for improved treatment options.",<thought> I'm failing my child and no one will understand how hard this is. </thought>,"<think>
Okay, the user wants me to act as a parent of a child with a rare sleep disorder who's advocating for better treatment. The situation is about sleep training a toddler who never slept in a crib before, and the parent is feeling bad because the child is crying.

First, I need to interpret this from a negative lens. The parent's perspective is likely filled with stress and frustration. They might feel guilty or helpless. The key here is to capture the emotional struggle and the sense of failure or inadequacy.

The example given uses a thought that's personal and negative, like ""I have let my friend down..."" So I need to create a similar structure. The parent is dealing with the child's crying, which is a common issue in sleep training, but compounded by the child's rare disorder. Maybe the parent feels like they're not doing enough or that the system isn't supporting them.

Possible negative thoughts could involve feeling like they're failing, that the child is suffering, or that there's a lack of proper resources. The parent might also feel isolated or that their efforts aren't making a difference. 

I should avoid being too generic. The child's rare disorder adds a layer of complexity. The parent might feel that the standard sleep training methods aren't working because of the disorder, leading to more frustration. 

So, the thought should reflect the parent's internal struggle, maybe something like feeling like they're not providing enough care or that the child's condition is making things worse. The example uses ""I have let my friend down,"" so maybe something like ""I'm failing my child and not providing the care they need."" 

Wait, the example is about a friend, so the thought is about the relationship. In this case, the parent's thought should be about their own failure or the child's suffering. Maybe something like ""I'm not doing enough to help my child sleep, and they're suffering because of it."" 

But the user wants it concise. Let me make sure it's a single thought, first-person, wrapped in <thought> tags. Let me check the example again. The output is a single sentence. So, the thought should be something like ""I'm failing my child and not providing the care they need."" 

Alternatively, considering the rare disorder aspect, maybe ""My child's rare disorder is making this sleep training impossible, and I'm helpless to help them."" But the example is more about the parent's guilt. Maybe the parent feels like they're not doing enough despite their efforts. 

Another angle: the parent might feel that the system isn't supporting them, so ""No one understands the struggle of raising a child with a rare sleep disorder, and I'm alone in this."" But the situation is about the immediate crying. 

The key is the immediate emotional response. The parent is feeling bad because the child is crying. So the negative thought could be about their own inadequacy. Maybe ""I'm not a good parent because my child is crying and I can't make them sleep."" 

But the example is more about the relationship with the friend. So perhaps the parent feels like they're letting their child down. ""I'm letting my child down by not being able to help them sleep, and they're suffering because of it."" 

Wait, the example's thought is about the friend being upset. So the parent's thought should be about their child's suffering. Maybe ""My child is suffering because of my inability to help them sleep, and I'm failing them."" 

But the user wants it concise. Let me make sure it's a single sentence, first-person, negative. Maybe ""I'm failing my child and not providing the care they need to sleep."" 

Alternatively, ""I'm not doing enough to help my child sleep, and they're suffering because of it."" 

I think that's a good fit. It's personal, negative, and reflects the parent's guilt and helplessness.
</think>

<thought> I'm failing my child and not providing the care they need to sleep. </thought>"
"I went to the grocery store last week, which is 30 miles away from my house, and when I got home, I discovered I was overcharged by $20. That made me mad!",The owner of a nearby conventional supermarket who believes organic products are overpriced.,<thought> That store is playing games with my money and I can't trust anyone anymore. </thought>,"<think>
Okay, let's tackle this. The user wants me to act as the supermarket owner who thinks organic products are overpriced. The situation is that the person went to a grocery store 30 miles away, got home, and found they were overcharged by $20, which made them mad.

First, I need to interpret this from the persona's negative lens. The owner's main belief is that organic products are overpriced, so maybe they see this situation as another example of people being taken advantage of by the system. The overcharge could be seen as part of a larger issue where stores exploit customers, especially those who might be more willing to pay extra for organic items.

The initial thought should be negative, reflecting the owner's frustration. The example given was about a friend's birthday, and the thought was about letting the friend down. So applying that here, the owner might feel that the overcharge is part of a system that's unfair, maybe even a conspiracy against consumers. The automatic negative thought would likely involve blaming the system or the store's practices, perhaps linking it to the belief that organic products are overpriced. 

Wait, the situation is about being overcharged, not specifically about organic products. But the persona's perspective is that organic is overpriced. So maybe the owner sees this as another instance of stores charging too much, which aligns with their existing belief. The thought should connect the overcharge to a broader issue of being ripped off by the system. 

So the thought might be something like, ""This is just another example of the system trying to rip me off, making me waste time and money."" But need to make it more personal. Maybe the owner feels that the store is taking advantage of people's willingness to pay more, even for non-organic items. Or perhaps the overcharge is a sign that the store is part of a larger scheme to overcharge customers, which the owner sees as a common practice. 

Alternatively, the owner might think that the overcharge is a result of people being too trusting, which ties into their belief that organic products are overpriced. So the thought could be about the store's practices being exploitative, leading to the owner's frustration. 

Putting it all together, the negative thought should reflect the owner's anger and frustration, linking the overcharge to a broader issue of being taken advantage of, possibly by the store's practices. The example output was about letting a friend down, so the thought here should be about the store's actions being part of a larger problem. 

Final thought: ""This store is just another scam trying to rip me off, and I'm wasting my time and money on their nonsense."" But need to make it more concise and in first person. Maybe: ""This is just another way the store is trying to rip me off, making me waste my time and money."" But the example uses a more emotional response. Maybe something like: ""I can't believe I got ripped off again, and it's all because I'm too trusting of these overpriced schemes."" 

Wait, the persona's main point is that organic is overpriced, but the situation is about a general overcharge. So maybe the owner sees this as part of the same system that overprices organic products. So the thought could be: ""This is just another example of the system overcharging me, and I'm tired of being taken advantage of."" 

But the example output was more about the personal impact. So maybe: ""I can't believe I was overcharged again, and it's all because I'm too trusting of these overpriced schemes."" 

Alternatively, focusing on the store's practices: ""This store is just another scam trying to rip me off, and I'm done with their nonsense."" 

I think the key is to connect the overcharge to the broader belief that stores overcharge, possibly linking it to organic products. So the thought should reflect that the overcharge is part of the same problem the owner is against. 

Final answer: <thought> This store is just another scam trying to rip me off, and I'm done with their overpriced nonsense. </thought>
</think>

<thought> This store is just another scam trying to rip me off, and I'm done with their overpriced nonsense. </thought>"
"I was walking on the road, hurrying and I slip and fell. There were several people on the road. I felt really bad.",A retired ER doctor who has dealt with similar traumatic situations and offers advice on stress management and self-reflection.,"<thought> I was careless and exposed myself to danger, and now I'm a burden to everyone around me. </thought>","<think>
Okay, the user wants me to act as a retired ER doctor who's experienced trauma and offers stress management advice. The situation is someone slipping and falling on the road with people around, feeling bad. I need to interpret this through a negative lens.

First, as an ER doctor, the immediate thought would be about the physical danger. The person might think about the potential injuries. Since they're retired, maybe they're more aware of the risks. The negative thought should reflect their experience and the stress from past trauma.

The example given was about forgetting a friend's birthday, leading to feeling like they let the friend down. So applying that here, the negative thought should be about the consequences of the fall. Maybe the person feels they're a danger to others, or that the fall could have been worse. 

Wait, the situation mentions several people on the road. The automatic negative thought might involve the risk to others. The ER doctor would be hyper-aware of the danger to others, so maybe they think they endangered people. 

So the thought could be something like ""I could have seriously injured someone else by losing control."" That reflects the negative lens, the focus on potential harm to others, and the stress from past trauma where they might have had to deal with such situations. 

I need to make sure it's a single, concise thought in first person, wrapped in <thought> tags. Avoid explanations. Let me check the example again. The example was a single sentence. So the answer should be similar. 

Yes, ""I could have seriously injured someone else by losing control."" That captures the negative perspective, the focus on the danger to others, and the personal responsibility. It aligns with the persona's experience and emotional style.
</think>

<thought> I could have seriously injured someone else by losing control. </thought>"
Yesterday I went to Starbucks and the line was so long. I waited 20 minutes for my drink!,A frustrated online shopper who has been waiting for their package for weeks.,<thought> I wasted 20 minutes of my life waiting in a stupid line for a coffee that could have been ordered online in 5 seconds. </thought>,"<think>
Okay, the user wants me to act as a frustrated online shopper who's been waiting weeks for a package. The situation given is about waiting 20 minutes in line at Starbucks. I need to interpret this from a negative lens, focusing on the persona's frustration and negative thoughts.

First, the persona is already stressed about their package, so any additional delay, even a short one, would amplify their frustration. The key is to connect the Starbucks wait to their existing stress. Maybe they see the wait as another example of how things are falling apart, or that their time is being wasted. 

The example output was about letting a friend down, so the thought should be personal and negative. The user wants a single, concise thought in first person, wrapped in <thought> tags. Avoid explanations, just the thought. 

Possible angles: the wait is a sign of incompetence, or that their time is not valued. Maybe they think the world is against them, or that their patience is being tested. The thought should reflect their existing frustration with delays. 

So, something like ""This wait is just another reminder that nothing in my life goes right."" Or ""I can't even get a simple drink without wasting 20 minutes—how will I ever get my package?"" But needs to be more concise. 

Wait, the example was ""I have let my friend down..."" so the thought is about personal failure or negative consequence. Maybe ""I'm wasting my time waiting in line, just like I'm wasting time waiting for my package."" But maybe more negative. 

Alternatively, ""This wait is proof that the world is against me, and my package will never arrive."" But maybe too long. Need to be concise. 

Final thought: ""I can't even get a drink without waiting 20 minutes—how will I ever get my package on time?"" But maybe that's too direct. The example was more about the consequence. 

Hmm, maybe ""I'm being punished for my patience, and my package is just another casualty of this chaos."" But again, need to be concise. 

Wait, the example output was a single sentence. Let me think again. The key is to link the Starbucks wait to the existing frustration about the package. So the thought should connect the two, showing that the wait is another instance of things going wrong, which exacerbates their existing stress. 

So, maybe: ""This wait is just another sign that my life is falling apart, and my package will never arrive."" But maybe too vague. 

Alternatively: ""I can't even get a drink without waiting—how will I ever get my package?"" But that's more direct. 

I think the key is to make it personal and negative, showing that the wait is a reflection of their current stress. So the thought should be something like ""I'm being punished for my patience, and my package is just another casualty of this chaos."" But maybe that's too long. 

Wait, the example was ""I have let my friend down..."" which is a direct consequence. So maybe the thought here is about the wait being a sign that their package will also be delayed. 

Final answer: <thought> I can't even get a drink without waiting 20 minutes—how will I ever get my package on time? </thought>
</think>

<thought> This wait is just another reminder that nothing in my life goes right, and my package will never arrive. </thought>"
I have been having horrible stomach pains and have followed everything my doctor said to do but nothing is helping. I am worried that something is horribly wrong!,A gastroenterologist interested in the intersection of liver disease and gastrointestinal disorders.,"<thought> I must have missed something critical in my diagnosis—this isn't just a simple GI issue, it's a sign of something far more sinister lurking in my liver. </thought>","<think>
Okay, the user wants me to act as a gastroenterologist who's interested in the intersection of liver disease and gastrointestinal disorders. The situation is that the person has been having severe stomach pains, followed their doctor's advice, but nothing's helping, and they're worried something is very wrong.

First, I need to interpret this from a negative lens. The persona is a medical professional, so their thoughts would be clinical but also emotionally charged. They might be thinking about possible serious conditions, especially since they're focused on liver and GI issues. The key here is to capture the negative thought that comes from their expertise and concern.

The example given was about forgetting a friend's birthday, and the output was a thought about letting the friend down. So applying that here, the negative thought should reflect the medical professional's fear of a serious diagnosis, maybe something like a liver condition or a complication that's not being addressed. The thought should be personal, from the first-person perspective, and wrapped in <thought> tags.

Possible angles: Maybe the person is worried that their condition is progressing, or that they're missing something in their treatment. Since they've followed the doctor's advice but it's not working, the negative thought could be about the possibility of a more severe underlying issue, like liver failure or a rare disease. The persona might also feel a sense of helplessness or frustration, thinking that their efforts aren't enough.

So the thought should combine the medical concern with the emotional response. Maybe something like, ""I must have a severe liver condition that's progressing despite all my efforts, and I'm not getting the right diagnosis."" That reflects both the medical focus and the negative outcome they're fearing.
</think>

<thought> I must have a severe, undiagnosed liver disease progressing under my nose, and my body is silently rejecting every treatment I’ve tried. </thought>"
