situation,persona_profile,initial_thought,think_initial_thought
I hate it when I get ignored. It makes me feel less human and I get very mad!,An introverted college student named Mullins who dislikes unnecessary attention.,"<thought> No one notices me, and I’m just invisible to everyone. </thought>","<think>
Okay, the user wants me to act as Mullins, an introverted college student who dislikes unnecessary attention. The situation given is about hating when someone ignores you, feeling less human, and getting very mad. I need to interpret this through a negative lens, focusing on Mullins' perspective.

First, I should consider Mullins' personality traits. Being introverted, he might feel uncomfortable with social interactions, especially if he's not the center of attention. Disliking unnecessary attention means he's probably sensitive to being overlooked or ignored. 

The situation is about being ignored, which makes him feel less human and angry. So, his initial thought would likely be a negative self-assessment. Maybe he feels like he's not worth noticing or that others don't value him. Since he's introverted, he might internalize the rejection, leading to feelings of worthlessness.

Automatic negative thoughts often involve self-criticism or fear of rejection. For Mullins, being ignored could trigger a thought like ""I'm not important enough to be noticed,"" which aligns with his dislike of attention and his introverted nature. He might also feel that others are dismissing him, which could make him feel isolated or unimportant.

I need to make sure the thought is in first person, concise, and wrapped in <thought> tags. Avoid any explanations, just the thought. The example given was about forgetting a friend's birthday, leading to feeling let down. Similarly, here, the thought should reflect the immediate negative reaction to being ignored. 

So, the thought should capture the feeling of being unimportant and the anger. Maybe something like ""They don't see me as a person, just an afterthought."" That conveys the negative perspective without being too wordy. Alternatively, ""I'm invisible to them, which makes me feel like I don't exist."" But the example was more about self-blame. Maybe ""I'm not worth their attention, so they ignore me."" Wait, the example was ""I have let my friend down..."" which is self-blame. So perhaps Mullins would think he's responsible for being ignored, even though it's not his fault. 

Alternatively, ""They don't care about me, so I'm not worth caring about."" But the key is to make it a negative thought that's automatic. Maybe ""I'm not important enough to be noticed, so they ignore me."" That's concise and in first person. Let me check the example again. The example output was about letting the friend down. So the thought is about self-blame. So maybe Mullins would think something like ""I'm not worth their attention, so they ignore me."" That's a negative thought, self-critical, and fits the persona. 

Alternatively, ""They don't value me, so I'm not valuable."" But the situation is about being ignored, not about the value. The key is the feeling of being unimportant. So the thought should reflect that. Maybe ""I'm invisible to them, which makes me feel like I don't exist."" But the example was more about self-blame. Hmm. The user's example was ""I have let my friend down..."" which is self-blame. So maybe Mullins would think he's responsible for being ignored. But that might not be accurate. Alternatively, he might think that others don't see him as a person. 

Wait, the original situation says ""I hate it when I get ignored. It makes me feel less human and I get very mad!"" So the negative thought would be something like ""They don't see me as a person, so I'm not human."" But that's a bit abstract. Maybe ""I'm not important enough to be noticed, so they ignore me."" That's concise and in first person. Let me go with that.
</think>

<thought> They don’t see me as a person, just an afterthought. </thought>"
I recently learned that a close friend is getting foreclosed on their home.,A retired real estate agent who witnessed the impact of the foreclosure crisis on the local community.,"<thought> I knew this day would come, but seeing it happen to someone I care about just breaks my heart all over again. </thought>","<think>
Okay, the user wants me to act as a retired real estate agent who's seen the foreclosure crisis hit the community. The situation is that the user's close friend is facing foreclosure. I need to interpret this from a negative lens, focusing on the persona's perspective.

First, I should recall the persona's background. As a retired real estate agent, they've probably seen many foreclosures up close. They might feel a mix of helplessness and anger towards the system that allowed this to happen. The key is to capture their emotional response and the negative thoughts that come with it.

The example given was about forgetting a friend's birthday, and the output was a thought about letting the friend down. So, applying that structure here, the thought should be personal and negative, from the first-person perspective.

What would a retired real estate agent think when a close friend is facing foreclosure? They might feel that the system has failed, or that the friend is being punished for something beyond their control. Maybe they blame the banks or the housing market. But the persona's own negative thought would likely be more about the personal impact on the friend and the community.

The automatic negative thought should be something like feeling that the friend is being ruined by the system, or that the community is being destroyed. Maybe something about the friend's hard work being undone. The example used ""let my friend down,"" so maybe something similar but related to the foreclosure.

Possible thoughts: ""My friend's life is being destroyed by a broken system."" Or ""The banks are taking everything from my friend."" But need to make it concise and in first person. Maybe ""I can't believe the system allowed my friend to lose everything."" Wait, the example was a single thought without explanation. So the thought should be a direct negative reaction.

Another angle: the persona might feel that the friend's situation is a result of the crisis they've witnessed, leading to a sense of helplessness. So the thought could be about the friend's hard work being in vain or the community's trust being broken. 

Finalizing, the thought should be something like: ""My friend's life is being torn apart by the same system that ruined our community."" But need to make it more concise. Maybe ""The system has finally taken everything from my friend."" Or ""My friend is being punished for a crisis they didn't cause."" 

Wait, the example was ""I have let my friend down..."" so the thought is about personal failure. Maybe the persona feels responsible or that the friend is being let down by the system. So the thought could be ""The system has let my friend down, and there's nothing I can do about it."" But the example didn't include the system. Alternatively, ""My friend is being destroyed by the same greed that ruined our neighborhood."" 

Hmm, need to make sure it's a single, concise negative thought. Maybe ""The banks have taken everything from my friend, and there's no hope left."" Or ""My friend's hard work is being erased by a broken system."" 

I think the key is to capture the persona's frustration and the negative impact on the friend and community. So the final thought might be something like: ""My friend's life is being destroyed by the same greed that ruined our community."" But need to check the example's structure. The example was a single sentence within <thought> tags. So the answer should be a single sentence, first person, negative.
</think>

<thought> My friend's life is being destroyed by the same greed that ruined our community. </thought>"
I think I am going to have to serve on a jury and I am terrified,A fellow doctoral student studying the impact of implicit biases on jury decision-making.,<thought> I’m going to be forced to make a decision that will unfairly condemn an innocent person based on nothing but my subconscious prejudices. </thought>,"<think>
Okay, the user wants me to interpret the situation of having to serve on a jury through a negative lens, as a doctoral student studying implicit biases. The example given was about forgetting a friend's birthday, and the output was a negative thought about letting the friend down.

First, I need to understand the persona's perspective. They're a doctoral student focused on implicit biases affecting jury decisions. So their fear is likely tied to the potential for bias in the jury process. They might be worried about their own biases influencing the verdict or the system's fairness.

The situation is the user being terrified about serving on a jury. The negative thought should reflect their academic focus and personal anxiety. They might think about how their own implicit biases could affect the trial, leading to an unjust outcome. The thought should be personal and negative, showing their fear of contributing to systemic issues.

I need to make sure the thought is in first person, concise, and wrapped in <thought> tags. Avoid explanations, just the thought. The example used ""I have let my friend down,"" so following that structure, the thought should be about their role in the jury and the consequences of their biases.

Possible negative thoughts: ""I might unconsciously let my biases influence the verdict, perpetuating systemic injustice."" But maybe more personal. Maybe something like ""I could be complicit in an unjust verdict due to my hidden prejudices."" Or ""My implicit biases might sway the jury's decision, leading to an unfair outcome."" Need to make it personal and negative, showing fear of their own biases affecting the process.
</think>

<thought> I’ll be forced to let my biases dictate justice, condemning an innocent person to punishment I can’t even name. </thought>"
I had to take a trip away from home for three weeks. It made me so nervous I couldn't sleep.,An aerospace engineer who uses the travel experiences to mentally escape from their complex work.,<thought> I can't even handle a three-week trip without my mind falling apart—what's wrong with me? </thought>,"<think>
Okay, the user wants me to act as an aerospace engineer who uses travel to escape work. The situation is that the person had to take a three-week trip and got so nervous they couldn't sleep. I need to interpret this through a negative lens.

First, I should think about the engineer's perspective. They might view the trip as a disruption to their work, which is their main focus. The nervousness and inability to sleep could be linked to the stress of leaving their work behind. Maybe they feel their work is incomplete or that they're neglecting their responsibilities.

The automatic negative thought should reflect their anxiety about the trip affecting their work. Since they use travel as an escape, being away might make them feel disconnected from their projects. Maybe they think about the consequences of being away, like missed deadlines or errors in their work.

I need to make sure the thought is in first person and negative. The example given was about a friend's birthday, so the thought was about letting the friend down. Applying that here, the engineer might feel responsible for their work and fear that the trip will cause problems. 

Possible thought: ""I'll be away for three weeks and my projects will fall apart without me."" But maybe more specific. Since they use travel to escape, maybe they feel guilty about leaving their work, thinking they can't handle it. Or they might worry about the complexity of their work being left unattended. 

Another angle: the trip is a necessary escape, but the engineer is anxious about the work. So the negative thought could be about the work suffering because they're not there. Maybe something like ""My work will collapse while I'm gone, and I'll have to deal with the consequences when I return."" But need to make it concise. 

The example output was a single thought. So maybe: ""I'll be away for three weeks and my projects will fall apart without me."" That's concise and negative. Alternatively, ""I can't escape my work, even on this trip, because I'll be thinking about it constantly."" But the key is the negative impact on their work. 

Wait, the situation is that the trip made them nervous and they couldn't sleep. So the negative thought is about the trip causing anxiety, but also the work. Maybe the thought is about the trip being a burden on their work. So the thought could be: ""I can't leave my work behind, and this trip will only add to the stress I already have."" But maybe more direct. 

Alternatively, since they use travel to escape, the trip is supposed to be a break, but the anxiety is because they can't escape from work. So the thought might be: ""I can't escape my work, even on this trip, because I'll be thinking about it constantly."" But the example was more about the consequence of the action. 

Hmm. The key is the negative thought that arises from the situation. The person is nervous about the trip, can't sleep. The negative thought could be about the trip being a failure, or the work suffering. Maybe: ""I'll be away for three weeks and my work will suffer because I can't focus on it."" But maybe more specific. 

Alternatively, since they are an aerospace engineer, maybe they think about the technical aspects. Like, ""My calculations will be off because I'm distracted by the trip."" But that's more specific. 

The example given was about a friend's birthday, and the thought was about letting the friend down. So the structure is about the consequence of the action. So for the trip, the consequence is the work suffering. So the thought could be: ""I'll be away for three weeks and my projects will fall apart without me."" That's concise and negative. 

I think that's the right direction. So the final thought would be that.
</think>

<thought> I'll be away for three weeks and my projects will fall apart without me. </thought>"
I worked for a company for 5 years and I found a new job that paid better. I worked out the last of my shifts but I felt bad for leaving a company that was so good to me.,A software developer who was also frustrated with the company's unethical practices but chose to stay and try to bring about change from within.,<thought> I betrayed the trust I had in the company and now I feel like a coward for walking away. </thought>,"<think>
Okay, the user wants me to interpret the situation through the persona's negative lens. The persona is a software developer who's frustrated with the company's unethical practices but stayed to try to change things from within. The situation is that the person worked for 5 years, found a better-paying job, and is feeling bad about leaving a company that was good to them.

First, I need to capture the persona's internal conflict. They value staying and trying to make a difference, even if the company has unethical practices. So leaving the job might feel like a betrayal, not just a career move. The negative thought should reflect that guilt and maybe the belief that they failed to effect change. 

The example given uses a thought like ""I have let my friend down..."" so the structure is a personal, negative self-assessment. The key elements here are the company being good to them, the better pay, and the internal conflict of leaving despite their values. 

The persona might feel that by leaving, they're abandoning their responsibility to change the company from within. So the negative thought could be about failing to make a difference, even though they were trying. Maybe something like ""I abandoned my responsibility to change the company from within, even though I knew it was the right thing to do."" But that's a bit long. Need to make it concise. 

Alternatively, focusing on the guilt of leaving a good company that was good to them, but also the ethical conflict. Maybe ""I betrayed the company that trusted me by leaving for a better paycheck, even though I knew their practices were wrong."" But the example is more about the personal impact. 

Wait, the example's thought is about letting the friend down. So the persona's thought should be about their own failure or guilt. Maybe ""I failed to stand up for what's right and left the company for money, even though I knew they were unethical."" But the user wants a single, concise thought. 

Another angle: the company was good to them, so leaving feels like a betrayal. But they also had to consider their own needs. The negative thought might be that they couldn't balance their ethics with their career. So something like ""I couldn't reconcile my ethics with my career and left the company, even though I knew they were unethical."" 

But the example is more about the emotional impact. Maybe the persona feels that by leaving, they're not doing their part to change the company, which is a personal failure. So the thought could be ""I abandoned my mission to change the company from within and left for a better paycheck, even though I knew their practices were wrong."" 

But the user wants it concise. Let me check the example again. The example output is ""I have let my friend down and they will be upset with me."" So it's a personal negative thought about the impact on the friend. 

Applying that here, the persona might think that by leaving, they're letting the company down, or that they failed to make a difference. So maybe ""I let the company down by leaving for a better job, even though I knew their practices were unethical."" 

Alternatively, focusing on the internal conflict: ""I couldn't stand up to the company's unethical practices and left for a better paycheck, even though I knew I should have stayed."" 

But the key is to capture the negative thought from the persona's perspective. The persona is frustrated with the company's unethical practices but stayed to try to change things. So leaving might feel like a failure to fulfill that commitment. 

So the thought could be: ""I failed to make a difference and left the company for money, even though I knew they were unethical."" 

But maybe more concise: ""I abandoned my duty to change the company from within and left for a better paycheck, even though I knew they were unethical."" 

But the example is shorter. Let me try to make it as concise as possible. Maybe: ""I let the company down by leaving for a better job, even though I knew their practices were wrong."" 

Yes, that's concise and captures the negative thought of betrayal and the ethical conflict.
</think>

<thought> I let the company down by leaving for a better paycheck, even though I knew their practices were wrong. </thought>"
I don't like working with managers that try to micro-manage me,An IT manager who dislikes modifying system privileges in a way that might compromise security.,"<thought> These managers think they know better than I do about how to run this system securely, and it's frustrating when they don't trust my judgment. </thought>","<think>
Okay, the user wants me to act as an IT manager who dislikes changing system privileges that could compromise security. The situation given is about not liking managers who micro-manage. I need to interpret this from a negative lens, focusing on the persona's perspective.

First, the persona's main concern is security. So, when a manager micromanages, the IT manager might see this as an unnecessary interference. The negative thought should tie into security risks. Maybe the manager's micromanagement leads to poor security practices. 

The example output was about letting a friend down. So the thought is personal and negative. Applying that here, the IT manager might feel that micromanagement leads to security vulnerabilities. The automatic negative thought would be something like the manager's actions causing security breaches. 

I need to make sure the thought is in first person, concise, and within the tags. Let me check the example again. The output was a single thought without explanation. So, the thought should directly relate to the situation and the persona's values. 

Possible thought: ""Micro-managing my system privileges will create security vulnerabilities that I can't control."" That connects the micromanagement to security risks, which aligns with the persona's dislike of compromising security. It's negative and personal, as required.
</think>

<thought> Micro-managing my system privileges will create security vulnerabilities that I can't control. </thought>"
I hate the ocean. I am very scared.,A seasoned cruise-traveler with a morbid fear of getting left behind by the ship.,"<thought> The ocean is alive and it wants to swallow me whole, and I can't even feel the ship moving anymore. </thought>","<think>
Okay, the user wants me to act as a seasoned cruise traveler with a fear of being left behind. The situation is that the person hates the ocean and is very scared. I need to interpret this through a negative lens.

First, I should think about the persona's perspective. They're afraid of being left behind, so any situation involving the ocean would trigger that fear. The key here is to connect the fear of the ocean with the fear of being left behind. 

The user's example input was forgetting a friend's birthday, and the output was about letting the friend down. So applying that structure, the negative thought should be about the ocean causing them to be left behind. 

The person hates the ocean, so maybe they feel the ocean is a threat. The automatic negative thought would be something like the ocean trying to leave them behind. Maybe something like ""The ocean is trying to leave me behind again, and I can't even swim."" That ties the fear of the ocean with the fear of being left behind, which is central to the persona. 

I need to make sure it's a first-person thought, concise, and wrapped in the tags. Avoid any explanations, just the thought. Let me check if that fits. Yes, it reflects the fear and the negative perspective. Alright, that should work.
</think>

<thought> The ocean is trying to leave me behind again, and I can't even swim. </thought>"
I watched a news report about the mistreatment of animals. The behavior of these people is something I can't stand,I am an animal rights activist and work for an international environmental organization.,"<thought> These people are blind to the suffering they cause, and I can't believe they even see the animals as living beings. </thought>","<think>
Okay, the user wants me to act as an animal rights activist for an international environmental organization. The situation is watching a news report about animal mistreatment, and the persona can't stand the behavior. I need to interpret this through a negative lens, focusing on their perspective and emotions.

First, the persona is likely feeling intense anger and helplessness. They might see the mistreatment as a reflection of humanity's disregard for life. The key here is to capture that negative emotion without being too vague. The example response uses a specific thought about letting someone down, so I should mirror that structure.

The automatic negative thought should be personal and emotional. Maybe something about humanity's cruelty or the futility of their efforts. Words like ""cruelty,"" ""indifference,"" ""degradation"" come to mind. The thought needs to be concise and in first person. Let me try: ""This cruelty is a testament to humanity's indifference, and I'm powerless to stop it."" Wait, maybe ""testament"" is too formal. How about ""This cruelty reveals humanity's callousness, and I'm trapped in a world that refuses to change."" Hmm, ""trapped"" adds that feeling of helplessness. Or ""This is proof that humanity will never learn, and I'm fighting a losing battle."" That's more direct. Let me check the example again. The example was about letting a friend down. So the thought should be a personal consequence. Maybe ""These people's actions are a direct attack on all life, and I can't bear to watch another moment of suffering."" No, maybe too long. Need to be concise. ""This cruelty is a reflection of humanity's moral decay, and I'm powerless to stop it."" That's good. It's personal, negative, and captures the emotion. Let me make sure it's wrapped in <thought> tags and no explanation. Yeah, that should work.
</think>

<thought> This cruelty is a reflection of humanity's moral decay, and I'm powerless to stop it. </thought>"
