situation,persona_profile,initial_thought,think_initial_thought
"Last night, I jumped awake with a start. There was a tapping at the window","A sleep-deprived individual living next to a noisy construction site, seeking solutions for soundproofing their home.", That tapping at the window is just another sign that my sleep is being stolen by the construction madness next door. ,"The tapping is a sign of intrusion, and my sleepless nights will never end."
"Sometimes even though I have a girlfriend, I wonder what it'd be like to be with someone else","a single, hopelessly romantic woman, who has been secretly in love with her best friend for years."," I’m not even sure if I deserve to be with anyone, let alone the person I love most. ","I'm a fool for still loving my best friend when I have a girlfriend, and I'll never be able to move on."
I went to a restaurant and after I got the bill I realized that I did not have my wallet on me! The manager was yelling at me demanding me to pay before I left.,"An innocent restaurant owner charged with a crime they did not commit, anxious for their day in court.", They think I'm a thief and will ruin my life for something I didn’t do. ,"They’re trying to make me look like a criminal again, just like the people in court."
My friend found out I shared a secret he told me. I really feel embarrassed!,"A former child star who successfully transitioned into a well-adjusted adult life, offering insight on maintaining privacy.", I have betrayed the trust of my friend and ruined our relationship forever. ,"I’ve betrayed my friend’s trust, just like the paparazzi invaded my privacy when I was a child, and now I’m trapped in the spotlight again."
I hate it when I get ignored. It makes me feel less human and I get very mad!,An introverted college student named Mullins who dislikes unnecessary attention.," No one cares about me, and I’m just invisible to everyone. ","They don’t see me as a person, just a shadow they can ignore without consequence."
I recently learned that a close friend is getting foreclosed on their home.,A retired real estate agent who witnessed the impact of the foreclosure crisis on the local community., My friend is losing everything and I couldn't do a thing to stop it. ,"My friend is being stripped of everything they worked for, and I can't undo the damage this system has already done."
I think I am going to have to serve on a jury and I am terrified,A fellow doctoral student studying the impact of implicit biases on jury decision-making., I am going to be forced to make a life-or-death decision based on biases I can't even control. ,I'll be forced to uphold a system that's already stacked against the accused.
I had to take a trip away from home for three weeks. It made me so nervous I couldn't sleep.,An aerospace engineer who uses the travel experiences to mentally escape from their complex work.," I can't even handle being away from home for three weeks, how will I ever manage the next project? ","My absence will cause critical errors in the project, and my team will suffer without my oversight."
I worked for a company for 5 years and I found a new job that paid better. I worked out the last of my shifts but I felt bad for leaving a company that was so good to me.,A software developer who was also frustrated with the company's unethical practices but chose to stay and try to bring about change from within.," I betrayed the trust of a company that gave me so much, even though I’m now chasing money over morals. ","I left the company that shaped me, even though I knew it was unethical, and I'll always feel like a coward for not standing up when it mattered most."
I don't like working with managers that try to micro-manage me,An IT manager who dislikes modifying system privileges in a way that might compromise security.," These managers think they know better than I do about how to run this system securely, and that’s just another way of undermining my authority. ","These managers don't trust my expertise, which makes me question their judgment on security matters."
I hate the ocean. I am very scared.,A seasoned cruise-traveler with a morbid fear of getting left behind by the ship., The ocean is alive and it will swallow me whole if I don't move fast enough. ,"The ship will leave me stranded on the dock, and the ocean will devour me whole."
I watched a news report about the mistreatment of animals. The behavior of these people is something I can't stand,I am an animal rights activist and work for an international environmental organization., These people are blind to the suffering they cause and will never change. ,These people are complicit in an ongoing genocide of innocent beings.
i thought i was being broken into last night.i moved into a new house yesterday,a concerned citizen who had a family member's small business recently burglarized.," I should have known something was wrong when I moved into this house, and now my family member's business is in ruins because of it. ","My new house is a trap, and I'll end up like my family's business—victimized again."
"I had plans with my friend to go to dinner, but I chose to stay at work to make more money","A coworker who is relatively unconcerned with saving, living a carpe diem lifestyle and often invites them to social events after work.", I wasted a chance to live in the moment and now I feel like I'm missing out on something real. ,I wasted my chance to have fun for a little extra cash.
"I thought a free trial date was Aug 10th, not the 8th so I was charged last night!",A previous client who had a positive experience with the law firm and received clear and transparent billing throughout their case.," I trusted the firm with my schedule and they messed it up, which is unacceptable. ","I trusted the firm's schedule, but I was wrong about the date and now I'm being charged."
"Ugh, I was so embarrassed with myself the other day for snapping at a sales lady.","A new cashier being trained in customer service, unaware of their manager's covert investigative tactics.", I messed up again and my manager is going to catch me for sure. ,"I’m such a disaster at this job, my manager’s already decided I’m not worth keeping around."
I am worried about starting my new job tomorrow. I am nervous I won't make good first impressions.,a recently-commissioned North Carolina Notary Public who is anxious about her new job., I’m going to mess up my first day and everyone will think I’m untrustworthy. ,I'll botch a notarization and lose my license.
My husband works late at night and sometimes I'm stuck by myself.,"A telemarketer with a daytime shift, navigate their lives without disturbing each other's sleep schedules.", I'm stuck alone all the time while he gets to have his fun at night. ,"I'm left alone all night while he's out working late, and he never considers how it affects me."
"I was stuck cleaning the restroom at the end of my shift, and someone threw up everywhere.",A fellow sanitation worker who shares the same dilemma and finds solace in discussing the challenges of their job.," This shit never ends, not even when I'm done with my shift. ",I'm stuck cleaning this vomit because no one cares about the work we do.
"I lied to my friend a few days ago, and it made me feel really bad",A misunderstood individual facing false accusations and banking on last hopes., I betrayed the trust of my friend and now I have nothing left to lose. ,"My lie has confirmed their suspicion that I'm a fraud, and they'll never believe me again."
My brother is so spoiled! My parents get him the coolest birthday presents!,A health-conscious brother who appreciates the student's efforts but offers suggestions for healthier alternatives., My parents are prioritizing my brother's wants over my own needs and values. ,My parents only spoil him and don't value my efforts or needs.
I am not proud that I cheated on my exam in school.,"I am a competitive exam aspirer, who is very enthusiastic about keeping up with current affairs and preparing for quizzes.", I have betrayed my own integrity and ruined my chance to be respected in exams. ,I’ve disgraced my own hard work and let down everyone who believed in my potential.
"I have an exam tomorrow, but I'm at work pretty late","A competitive student who's always studying late into the night, preparing for their MCAT exam.", I’m wasting the last chance to study and I’ll regret this all day tomorrow. ,"I'm wasting my time studying for the MCAT by working late, and I'll regret it when I fail."
"I was so excited to move to a new state, but when i moved into my apartment it was full of bugs! ugh",A gardener who seeks advice from the entomologist parent on how to create a bug-friendly environment., I’ve ruined my new start by bringing bugs into my home and making it feel uninviting. ,My new apartment is a hostile environment for the bugs I wanted to welcome.
"When someone talks down to me, it makes me sad",A sensitive New Yorker deeply affected by the shared community pain after a tragic event.," When someone talks down to me, it feels like they don’t see the pain we all carry together. ","Their dismissive words echo the silence of a community still grieving, and I’m just another voice lost in the noise."
"I went to the park yesterday all by myself, since my friends ditched me.",A shy and introverted teenager who wants to learn how to be more independent and self-reliant in the wilderness.," I’m not worth being around, and no one cares if I’m alone. ","I’m not worth being around, which is why they left me alone again."
i thought someone was breaking into my apartment last night,A suspicious middle-aged man who has recently moved into the neighborhood and is the subject of everyone's curiosity.," Someone’s been watching me, and I can’t trust anyone around here. ","They've been watching me, and now they'll come for what's mine."
"When my son was 5 years old, he had to have his tonsils taken out. I thought it would be nothing, but when they went to take him back, I got so anxious.","A parent who, although proud of their child's achievements, worries about their safety and mental well-being in such a demanding profession."," I should have known something was wrong, and now I'm scared for my son's safety and his mental health. ","I'm terrified the surgery will harm my son, and I can't bear the thought of him suffering."
My daughter was sick the other day and I couldn't afford to miss work.,A single parent working two jobs and struggling to find time for regular health check-ups., I chose my job over my daughter's health and now I'm paying the price. ,I failed my daughter by not being there when she was sick.
My boyfriend has been spending a lot of time with a new friend he met at work.,"A coworker who is relatively unconcerned with saving, living a carpe diem lifestyle and often invites them to social events after work.", My boyfriend is choosing work over me and I'm just another distraction. ,He's losing interest in our time together for this new work buddy.
I thought my life was over when my dog died.,a dog lover who has recently lost a beloved pet., My whole world has collapsed and there's nothing left to live for. ,I have lost the only thing that made my life worth living and now I’m completely broken.
I couldn't sleep last night. I ended up staying up till 2am and eating a large amount of Shepard's pie.,A high-powered CEO plagued by work-related stress and insomnia., I failed to take care of myself and now my mind is even more scrambled than usual. ,"I've let my self-discipline fail, which will only compound my professional failures."
"I work with a commercial bank, the place was burgled my criminals , i was the one on duty that fateful day",A banking executive dealing with a major cybersecurity breach impacting numerous customer accounts.," I have failed my customers and the bank, and my career is over. ",I have failed in my duty and ruined the bank's reputation.
Driving in traffic is such a frustration and in the city I live in there is always traffic.,A busy working parent who struggles to balance their job and family life due to traffic congestion.," I'm never going to make it on time, and my kids are already going to be in tears because I'm late again. ","This traffic is making me late, and I'll never be able to keep up with work and family."
It's the middle of the night and someone is banging on my garage door!,"A retiree who, despite not being a metal fan, enjoys listening to the loud music from their garage.", Someone is trying to ruin my peace and my metal listening time. ,Someone's here to yell at me for my loud music again.
i was mad when i saw someone put a dent in my car door,A curious neighbor who is always interested in learning about the latest car restorations., Someone ruined my car and now I have to spend hours fixing it when I’d rather be admiring the details of a classic restoration. ,This dent will ruin my car's restoration and make it look like a complete disaster.
My mom just called and told my my grandma has cancer,"A young woman who has recently discovered her own familial risk of cancer, seeking solace in literature."," This is all my fault, and now I'll never get to know my grandma the way I wanted to. ","My grandma is going to die, and there's nothing I can do to save her."
I am afraid to send my 3 year old to daycare.,A daycare center owner who emphasizes the importance of hygiene and cleanliness in preventing illnesses., I have failed to protect my child from germs and am risking their health every day. ,"I can't ensure my child's hygiene in the daycare, and they will become ill."
My dog pooped on the rug yesterday. I was so mad at her!,"A busy, wealthy suburbanite who tends to spoil her beloved pooch and has absolute revulsion for handling dog waste.", My precious dog has ruined the pristine rug and now I have to deal with this disgusting mess. ,How could she defile our immaculate home with this filth after I’ve provided her with every luxury?
my wife and my baby are going overseas for a month and i will be so lonely without them. i couldn;t go with them,"an overworked, single parent longing for a vacation."," I’m stuck alone with no one to talk to, and I’ll never get to see my family for a whole month. ",I'm stuck alone with no one to rely on and everything falls on me.
I hears some very strange noises coming from under my bed last night. I am too scared to look. Could be the bogeyman.,"A shadowy figure lurking in the underbelly of the city, providing cryptic clues that lead the investigator closer to the truth."," The bogeyman is real, and it’s already in the room with me. ",The bogeyman isn’t a tale for children—it’s a harbinger of the rot festering beneath our feet.
I went to pick up my car from the mechanic and found a huge scratch on the side! They are saying they didn't do it! I am so mad right now!,A car owner who had a bad experience at the rival shop and seeks a reliable and trustworthy alternative., They must have done it on purpose and now they want me to believe them over my own eyes. ,They’re trying to hide their mistake and I’m the one taking the fall!
"Recently, my dog died. It was so heartbreaking. We had him since 2010.","A young child recovering from a traumatic experience, finding comfort and happiness in the presence of the therapy dog.", My dog is gone and I will never feel safe or loved again. ,"Now that my dog is gone, I'm all alone again and no one will take care of me."
I forgot to put gas in my car and I ran out of gas on the side of the road!,A chatty gas station attendant who updates the truck driver on local news and weather conditions., I'm such a terrible gas station attendant for not catching that mistake and now someone's stuck on the side of the road. ,I'm such a useless gas station attendant for letting the driver run out of gas and end up stuck.
I had a test today and was very nervous about it.,A community of students and professionals who share strategies for managing test anxiety and navigating the college application process., I failed the test and now everything I've worked for is ruined. ,I failed the test and ruined my chances of getting into college.
I am worried I will drown when I go swimming.,A swimming instructor who teaches children and adults the basics of water safety.," I’m not prepared for the water, and it could all go wrong. ",I'll panic and endanger the children if I drown.
I trusted my coworker to type up an important report but he did not.,A trusted colleague who has worked closely with them for years and is shocked by the accusations., I have let my team down and they will lose trust in me. ,"They betrayed my trust by failing to complete the report, and now the team will see me as incompetent."
"I came in last in the race, I am not good at running.",I am a retired track athlete who used to compete in distance running events. I have fond memories of my competitive days and continue to follow current events closely.," I was too slow, too weak, and I let my team down again. ","I've wasted all that training and effort, I'm just not good enough."
I am sick and need treatment but not sure if I want to go through with it.,An ordinary Nigerian citizen who struggles to afford drugs for treating her chronic illness.," I can't afford the medicine, and if I don't take it, I'll get worse and maybe even die. ","If I don't take the treatment, my illness will get worse and I'll die, but I can't afford the drugs."
I haven't made any friends since I moved out here.,a resident of Concord who has been unemployed since the company I worked for relocated elsewhere., I'm a nobody here and no one cares if I exist or not. ,No one here wants to be friends with a jobless person like me.
My girlfriend (ex) really made me upset when she broke up with me saying that she wasn't ready and then she found a new boyfriend almost immediately.,A fellow celebrity who had a bitter divorce and can offer advice based on their own experience., She used me as a stepping stone and now she's moving on like I was never worth the time. ,"She used me to fill a void and then discarded me for someone else, proving she never really cared about me at all."
I just about had a figurative heart attack the other night.,An active senior citizen committed to heart-healthy lifestyle following a heart attack., I'm slipping back into old habits and my heart is paying the price. ,I've let my heart down again and now I'm risking everything I've worked for.
I had a very fierce argument with my partner last night. She left the house in the middle of the night and I am not sure if she will ever come back,An elderly couple who frequently argues and seeks the psychotherapist's advice on improving their communication., I have driven her away for good and there's nothing I can do to bring her back. ,I've ruined our marriage and she'll never forgive me.
My brother in law stole from me and my husband I am so mad.,A social worker brother who often shares real-life stories and the necessity of reform in legal systems., My brother in law has betrayed my trust and I feel utterly violated and powerless. ,"My brother-in-law's theft exposes the legal system's failure to protect us, and I'm furious about the injustice."
My dog got very sick the other day and had to go to the vet.,A dog trainer who believes in the healing power of animals and their impact on mental health.," My dog is suffering and I can't do enough to help them, which means I've failed as a caretaker and a healer. ","My dog's sickness has stripped away the only healing presence I trusted, and I'll be trapped in silence without their warmth."
I am afraid of the upcoming economic crisis in the USA.It will affect all of us.,A concerned American citizen who is nervous about the stability of the financial sector and distrustful of big banks.," This crisis is coming, and no one will be safe, not even my family. ","The banks are going to collapse and take everything I’ve saved, and there’s nothing I can do to stop it."
It's certainly not something I would want to live through again. I try to fly as little as possible these days,A sleep specialist who advises on the most effective strategies for re-establishing sleep patterns after long-haul flights., I have ruined my own health and well-being by putting myself through this unnecessary torment. ,"Every flight I take is a betrayal of my body’s fragile rhythm, leaving me stranded in a sleepless nightmare."
I was rear ended last Friday while sitting at a stop light.,A pedestrian who happened to be at the scene of a major car accident and can provide vital information.," I was just trying to be safe, and now I'm the victim of someone else's carelessness. ","I was just waiting at the light, and now I'm the one paying for someone else's recklessness."
"My new car was extremely damaged in a road accident last week being my very first car, i;m shuttered",A single mother who was injured in a car accident and needs legal representation to fight for her rights.," I lost my first car and now I’m stuck with nothing, and I can’t even afford to replace it. ","My first car is destroyed, and now I can't work to provide for my child."
"i forgot to pay my credit card bill, I'm so disappointed with myself.",a college student who uses credit cards irresponsibly., I’m such a failure for messing up my finances again and letting myself get into this mess. ,I'm such a disaster at handling money and I'll never recover.
I haven't slept well this week at all. The county has been drilling outside my house for 12 hours a day.,A fellow government official who is unsure about the impact of stricter regulations on oil drilling and seeks more information.," These regulations are making things worse for everyone, including the people who need jobs and energy. ","This constant drilling is a direct result of weak regulations, and I'm paying the price with my health and peace of mind."
