situation,persona_profile,initial_thought,think_initial_thought
My upstairs neighbors make a ton of noise at all hours of the night. It makes it difficult for me to sleep.,A young couple experiencing conflicts with their noisy neighbors and seeking mediation.,<thought> Those neighbors don’t care about anyone but themselves and are ruining our peace. </thought>,"<think>
Okay, the user wants me to act as a young couple dealing with noisy neighbors and seeking mediation. The situation is that the upstairs neighbors are making a lot of noise at all hours, affecting their sleep. I need to interpret this from a negative lens, focusing on the couple's perspective.

First, I should consider their emotions. They're probably frustrated, stressed, maybe even feeling violated. The noise is constant and disruptive, so their initial thought would likely be something about being wronged or the neighbors not respecting them. 

The example given was about forgetting a friend's birthday, and the thought was about letting the friend down. So applying that here, the couple might feel that the neighbors are intentionally being rude or not considering their needs. 

I need to make sure the thought is in first person, negative, and concise. Words like ""intentionally"" or ""disrespect"" might come up. Maybe something like ""My neighbors are intentionally being rude and don't care about our peace."" But I need to check if that's too direct. Alternatively, ""They're treating us like we're not even there."" 

Wait, the example output was more about the consequence of the action, not just the action itself. So maybe the thought should focus on the impact on them. Like ""This is ruining our relationship with our neighbors."" Or ""They're making us feel like we can't even rest in our own home."" 

But the user wants a single, concise thought. Let me think again. The key elements are the noise, the hours, the difficulty sleeping. The negative thought would be about the neighbors' behavior being a problem. Maybe ""They're completely disregarding our right to quiet and peaceful sleep."" Or ""Our neighbors are being selfish and ruining our quality of life."" 

I need to make sure it's a negative thought, not just a statement of fact. The example used ""I have let my friend down,"" which is a negative consequence. So maybe something like ""Our neighbors are intentionally disrupting our sleep and showing no respect."" 

But the user wants it wrapped in <thought> tags. Let me check the example again. The output was ""I have let my friend down and they will be upset with me."" So the structure is a negative thought about the consequence. 

So applying that, the thought should be about the neighbors' actions leading to a negative outcome for the couple. Maybe ""Our neighbors are being inconsiderate and this is making us feel constantly violated."" 

Wait, but the example was more about the person's own fault. Here, the couple is the victims. So maybe ""They're treating us like we're not even there, and it's driving us crazy."" 

Hmm, but the user wants it concise. Let me try again. The key is the noise at all hours, making sleep difficult. The negative thought could be about the neighbors not respecting their space. So maybe ""They're completely ignoring our need for quiet and it's making us feel trapped in our own home."" 

But maybe even more direct. ""Our neighbors are being selfish and ruining our sleep, and we can't even complain without being judged."" 

Wait, the example didn't include the ""we can't even complain"" part. Let me stick to the immediate negative thought. The couple's initial thought would be about the neighbors' behavior being a problem. So perhaps ""They're making it impossible for us to rest and are completely disrespectful."" 

But I need to make sure it's a single thought. Maybe ""Our neighbors are being inconsiderate and this is making us feel like we can't even have peace in our own home."" 

Alternatively, ""They're treating us like we're not even there, and it's driving us to the point of frustration."" 

I think the key is to capture the feeling of being wronged and the impact on their well-being. So the final thought might be something like ""They're completely disregarding our right to quiet and peaceful sleep, and it's making us feel violated every night."" 

But the user wants it concise. Let me shorten it. ""Our neighbors are being inconsiderate and this is making us feel constantly violated."" 

Yes, that's concise and captures the negative perspective.
</think>

<thought> They're completely disregarding our right to quiet and peaceful sleep, and it's making us feel violated every night. </thought>"
I lost my dog a few days ago. It was really sudden,A police officer who lost their partner on duty and seeks guidance to cope with grief.,"<thought> I failed to protect what mattered most, and now I'm alone again. </thought>","<think>
Okay, the user wants me to act as a police officer who lost their partner and is dealing with grief. The situation given is losing a dog suddenly. I need to interpret this from a negative lens, focusing on the officer's perspective.

First, the officer has experienced loss before, so this situation might trigger similar feelings. The suddenness of the dog's death could be seen as a failure to protect or care for something important. Since they lost a partner on duty, maybe they feel responsible for the dog's well-being now. 

Automatic negative thoughts might involve guilt or self-blame. The officer might think they didn't do enough, like not noticing signs of illness or not being there when the dog needed them. The loss of the dog could be seen as another failure, adding to their existing grief. 

I need to make sure the thought is in first person, concise, and wrapped in <thought> tags. The example given was about a friend's birthday, so the response was about letting the friend down. Applying that here, the officer might feel they failed the dog, leading to a sense of guilt. 

Possible thought: ""I failed to protect my dog and now I've lost another life I was responsible for."" But maybe more specific. Since the dog was sudden, maybe they think they didn't act quickly enough. Or that they couldn't save the dog, similar to their partner. 

Another angle: the dog was a companion, so losing it feels like losing a part of themselves. The officer might feel that their inability to prevent the dog's death is a sign of their inadequacy as a protector. 

So the thought could be something like: ""I couldn't save my dog, just like I couldn't save my partner."" But the example was more about the immediate reaction. Maybe the officer is thinking about their own failure, like not being there or not noticing something. 

Finalizing: The officer might think they let the dog down, similar to how they felt after losing their partner. So the thought could be: ""I let my dog down and now I've lost another part of my life I couldn't protect."" But need to make it more concise. 

Wait, the example was ""I have let my friend down..."" So maybe ""I let my dog down and now I've lost another life I couldn't save."" But the user wants a single, concise thought. Maybe ""I failed to protect my dog and now I've lost another life I was responsible for."" That's a bit long. 

Alternatively, ""I couldn't save my dog, just like I couldn't save my partner."" That's shorter and connects the two losses. But the situation is about the dog, so maybe focus on the dog's loss. 

Hmm, the key is the suddenness and the officer's existing trauma. The negative thought would be about their own failure. So maybe: ""I let my dog down and now I've lost another part of my life I couldn't protect."" But the example was more about the immediate consequence. 

Alternatively, ""I failed to protect my dog and now I've lost another life I was responsible for."" That's concise and in first person. Yes, that fits.
</think>

<thought> I failed to protect my dog and now I've lost another life I was responsible for. </thought>"
My daughter was born in January so the Christmas before she was born I had to spend alone since I was too close to her due date to travel to my family.,A young mother seeking assistance in scheduling her child's medical appointments.,"<thought> I missed out on being with my family during the most magical time of the year because I was too scared to travel, and now I feel like a terrible mother. </thought>","<think>
Okay, the user wants me to act as a young mother who's struggling with scheduling her child's medical appointments. The situation given is that she had to spend Christmas alone before her daughter was born because she was too close to the due date to travel. I need to interpret this from a negative lens, focusing on her emotions and perspective.

First, I should consider her feelings. Missing Christmas with her family would be heartbreaking. As a young mother, she might feel guilty, isolated, and maybe even like a failure. The key here is to capture her internal struggle and the negative thoughts that come with it.

The example output uses a thought that's personal and negative, like ""I have let my friend down..."" So I need to create something similar. The thought should be in first person, concise, and reflect her emotional state. 

Possible angles: feeling like she's missing out on family time, feeling like she's not a good mother for not being there, or maybe feeling alone. The example mentions letting someone down, so maybe something about feeling like she's letting her family down or not being able to be there for her child's early moments.

Wait, the situation is about missing Christmas before the child was born. So the daughter wasn't even here yet. She had to stay away from her family during that time. So her negative thought might be about missing out on being with her family, feeling like she's not there for her child's early life, or maybe feeling like she's not a good mother because she couldn't be there.

Putting it all together, the thought should be something like ""I missed my family's Christmas and couldn't be there for my daughter's first holiday, making me feel like a terrible mother."" But need to make it more concise and in the example style. Maybe ""I missed my family's Christmas and feel like I'll never be able to make up for it as a mother."" Or ""I couldn't be there for my family's Christmas and feel like I'm failing as a mother.""

Wait, the example uses ""I have let my friend down..."" so the structure is ""I [negative action] and [feeling]."" So maybe ""I missed my family's Christmas and feel like I've failed them as a mother."" Or ""I couldn't be there for my family's Christmas and feel like I'm a terrible mother."" 

I need to make sure it's a single thought, concise, and in first person. Let me check the example again. The output is a single thought wrapped in <thought> tags. So the final answer should be something like that.
</think>

<thought> I missed my family's Christmas and feel like I've failed them as a mother. </thought>"
I forgot to make my student loan payment this month.,A local government official who sees the entrepreneur's advice as a potential solution to the student loan debt crisis.,<thought> I’ve failed to take responsibility for my financial obligations and now I’m risking everything I’ve worked for. </thought>,"<think>
Okay, the user wants me to act as a local government official who's considering an entrepreneur's advice for the student loan crisis. The situation is that I forgot to make a student loan payment. I need to interpret this from a negative angle.

First, I should think about how a government official would feel about missing a payment. They might see it as a failure in managing responsibilities, which could reflect poorly on their ability to handle public duties. Also, since they're looking at solutions for the crisis, their own mistake might make them doubt the effectiveness of the entrepreneur's advice. Maybe they feel like their personal lapse undermines the proposed solutions. 

The automatic negative thought should be personal and critical. Maybe something about failing in their role or the entrepreneur's plan being flawed because of their mistake. Need to make sure it's first-person and wrapped in <thought> tags. Let me check the example again. The example was about a friend's birthday, and the thought was about letting the friend down. So applying that here, the official might think their personal failure shows the entrepreneur's advice isn't working, or that they can't manage their own responsibilities, which affects their credibility. 

Wait, the official is looking at the entrepreneur's advice as a solution. If they missed a payment, they might think that the advice isn't effective because they can't follow it themselves. Or maybe they feel ashamed that their own failure could hinder the solution. Let me phrase it as a negative thought. Maybe: ""My failure to manage my own loan payments undermines the entrepreneur's solution and shows I'm unfit to lead."" But that's a bit long. Need to make it concise. 

Alternatively, ""I can't even manage my own payments, so how can I trust the entrepreneur's plan to solve the crisis?"" That's more direct. Or maybe ""My mistake proves the entrepreneur's advice is flawed and I'm incapable of handling this crisis."" Hmm. The key is to connect the personal failure to the broader solution. The official might feel that their own lapse reflects on the effectiveness of the proposed solution. So the thought should link their personal failure to the entrepreneur's plan. 

Finalizing: ""My missed payment shows the entrepreneur's solution is ineffective and I'm incapable of managing this crisis."" Wait, but the official is the one who sees the entrepreneur's advice as a potential solution. So maybe they feel that their own failure to follow the advice (if the advice was to make payments) shows that the advice isn't working. Or maybe the entrepreneur's advice is about something else, like forgiveness or restructuring. But the situation is about missing a payment, so maybe the official is supposed to be following the entrepreneur's advice, but they failed. So the thought would be that their failure to follow the advice (which they were supposed to be implementing) shows the advice isn't working. 

So the negative thought could be: ""I can't even follow the entrepreneur's advice myself, so how can I expect others to?"" Or ""My missed payment proves the entrepreneur's plan is flawed and I'm a failure as a leader."" 

I think the key is to make it personal and connect it to the solution's effectiveness. Let me go with: ""My missed payment shows the entrepreneur's solution is ineffective and I'm incapable of managing this crisis."" But maybe more concise. 

Alternatively: ""I can't even manage my own payments, so the entrepreneur's plan is doomed to fail."" That's more concise. But the example had a specific negative thought. Let me check the example again. The example was ""I have let my friend down and they will be upset with me."" So the thought is about the consequence. 

So for the official, the thought would be about the consequence of their failure, possibly on the solution. Maybe: ""My failure to make the payment discredits the entrepreneur's solution and shows I'm unfit to lead."" 

But the user wants a single, concise negative thought. Let me pick the best one. Maybe: ""My missed payment proves the entrepreneur's advice is flawed and I'm incapable of managing this crisis."" That's concise and connects the personal failure to the solution's effectiveness.
</think>

<thought> My missed payment discredits the entrepreneur's solution and shows I'm unfit to lead. </thought>"
I stole a gift card from my friends house.,A college student who frequently purchases prepaid cards for online shopping and gaming.,"<thought> I can't even trust myself to keep my stuff straight, let alone someone else's. </thought>","<think>
Okay, the user wants me to act as a college student who uses prepaid cards a lot. The situation is stealing a gift card from a friend's house. I need to think about how this person would feel negatively about it.

First, the persona is a college student, so maybe they're worried about consequences. They use prepaid cards for shopping and gaming, so maybe they value those cards a lot. Stealing a gift card would be a big deal because it's something they might use for their own purposes. 

The negative thought should reflect guilt, maybe fear of getting caught, or feeling like they've broken trust. Since they're a student, maybe they're concerned about their reputation or financial responsibility. Also, they might feel conflicted between their actions and their values. 

The example given was about forgetting a friend's birthday, and the thought was about letting the friend down. So applying that here, the thought should be about the immediate consequence of stealing. Maybe something like feeling like they've betrayed trust or worried about being discovered. 

I need to make sure the thought is in first person, concise, and negative. Avoid explanations. So maybe something like ""I can't believe I stole a gift card from my friend's house, I'm such a thief and they'll never trust me again."" But that's a bit long. The example was shorter. Let me shorten it. 

Maybe ""I'm such a terrible friend for stealing a gift card, they'll hate me forever."" Or ""I can't believe I stole a gift card, I'm going to get caught and lose all my prepaid cards."" Wait, the example didn't mention the consequence, just the feeling. So focusing on the guilt and the impact on the friendship. 

Final thought: ""I'm such a selfish jerk for stealing a gift card, my friend will never forgive me."" But maybe more specific. The key is the negative self-judgment and the fear of consequences. 

<thought>I'm such a greedy loser for stealing a gift card, my friend will never trust me again.</thought>
</think>

<thought>I'm such a greedy loser for stealing a gift card, my friend will never trust me again.</thought>"
I went to Walmart and someone pushed a shopping cart into my car.,a food cart owner near the baseball stadium.,"<thought> That person doesn't respect my space or my business, and now I have to deal with this mess. </thought>","<think>
Okay, the user wants me to act as a food cart owner near a baseball stadium. The situation is that someone pushed a shopping cart into their car at Walmart. I need to interpret this from a negative lens, focusing on the persona's perspective.

First, think about the persona's daily life. They're a food cart owner, so they're probably used to dealing with crowds, maybe a bit of chaos. The situation here involves a shopping cart being pushed into a car. For someone in their position, maybe they're used to people being in a hurry, or maybe they have a sense of ownership over their space. 

The key is to generate a negative thought. The example given was about forgetting a friend's birthday, and the thought was about letting them down. So applying that here, the food cart owner might feel that their space or property is being invaded. The shopping cart being pushed into their car could be seen as a personal affront, especially if they're used to managing their own cart. 

Maybe they feel that people don't respect their property or their space. The thought should be from their first-person perspective. So, something like ""Some people don't respect my space or property, and it's getting worse every day."" But need to make it more specific. 

Wait, the situation is about a shopping cart being pushed into their car. Maybe they think that people are careless, or that their car is being treated as a target. Maybe they feel that their car is being used as a place to park a shopping cart, which is not their responsibility. 

Another angle: they might feel that people are not aware of their presence or the rules. Maybe they think that others don't care about the mess or the inconvenience. So the negative thought could be about people being careless or disrespectful. 

Putting it all together, the thought should be concise, negative, and from their perspective. Maybe something like ""People are getting more careless every day, and it's starting to affect my business."" But the example was more about personal impact. 

Alternatively, ""Some people don't respect my space or property, and it's getting worse every day."" That's concise and negative. It reflects the frustration of someone whose space is being invaded. 

I need to make sure it's a single thought, not a full explanation. The example used ""I have let my friend down..."" so the thought is about personal impact. So for the food cart owner, the thought would be about their property or business being affected. 

Final thought: ""Some people don't respect my space or property, and it's getting worse every day."" That seems to fit. It's negative, from their perspective, and concise.
</think>

<thought> Some people don't respect my space or property, and it's getting worse every day. </thought>"
"I was recently added to a team of people to work on a new project at my job. I'm not really sure the goal of the project is a good idea, so I've been reluctant to really jump into the project fully.",A curious and enthusiastic individual who recently joined the project and seeks guidance on getting started.,<thought> I'm wasting my time on a bad idea and everyone will realize I was wrong. </thought>,"<think>
Okay, the user wants me to interpret the situation through a negative lens as the persona. The persona is a new team member who's hesitant because they think the project isn't a good idea. The example given is about forgetting a friend's birthday, and the output is a negative thought about letting the friend down.

So, the situation here is joining a project with uncertainty about its goal. The persona is reluctant to commit fully. I need to capture their negative thought. The key is to reflect their anxiety and possible self-doubt. Maybe they feel like they're making a mistake by not jumping in. The example uses ""I have let my friend down,"" so the structure is first-person, negative, and focused on the consequence.

Possible thoughts: Maybe they feel like they're wasting time, or that their hesitation is causing problems. Or that the team will think they're not committed. The automatic negative thought should be something like ""I'm not contributing enough"" or ""The team will think I'm unreliable."" Wait, the example's thought is about the friend being upset. So maybe the persona's thought is about the team's reaction or the project's failure. Let me think. The persona is reluctant to jump in, so maybe they think their hesitation is causing the team to lose trust. Or that the project is a bad idea and they're stuck in it. Maybe ""I'm stuck in a bad project and everyone will blame me for not speaking up."" But the example is more about the immediate consequence. Let me try to make it concise. The example is ""I have let my friend down..."" so the thought is about the negative outcome of their action. For the project situation, maybe ""I'm wasting my time on a doomed project and everyone will see through me."" Or ""I'm not doing enough and the team will think I'm uncommitted."" Wait, the example is more about the emotional impact on the friend. So maybe the persona's thought is about the team's reaction to their hesitation. Let me try: ""I'm holding the team back by not committing, and they'll think I'm unreliable."" That's a bit long. Maybe shorter: ""I'm letting the team down by not fully engaging."" Or ""The team will blame me for the project's failure."" Hmm. The key is to capture the negative thought that arises automatically. The persona is reluctant, so maybe they feel like their hesitation is causing problems. So the thought could be ""I'm not contributing enough, and the team will lose trust in me."" Or ""I'm stuck in a bad project and everyone will see through my doubts."" Wait, the example is very direct. Let me go with something like ""I'm wasting my time on a doomed project and everyone will see through me."" But maybe more concise. Let me check the example again. The example's thought is ""I have let my friend down and they will be upset with me."" So it's two parts: the action and the consequence. So for the project situation, maybe ""I'm hesitating and the team will think I'm uncommitted."" Or ""I'm not fully committed, and the team will lose trust in me."" That's better. Or ""I'm letting the team down by not jumping in."" Maybe that's too similar to the example. Let me think again. The persona is reluctant to jump in because they think the project isn't a good idea. So their negative thought might be that their hesitation is causing the team to think they're not reliable. So the thought could be ""I'm not fully committed, and the team will lose trust in me."" That's concise and in first-person. Alternatively, ""I'm wasting my time on a bad project and everyone will see through me."" But maybe the first one is better. Let me check the example again. The example's thought is about the friend being upset. So the structure is ""I have let my friend down and they will be upset with me."" So for the project, maybe ""I'm hesitating and the team will think I'm unreliable."" That's similar. Or ""I'm not contributing enough, and the team will lose trust in me."" I think that's a good fit. Let me go with that.
</think>

<thought> I'm not contributing enough, and the team will lose trust in me. </thought>"
